{"$defs":{"component":{"additionalProperties":false,"properties":{"canonical_owner":{"type":"boolean"},"component_id":{"pattern":"^COMP-[A-Z]+$","type":"string"},"layer":{"minLength":3,"type":"string"},"name":{"minLength":5,"type":"string"}},"required":["component_id","name","layer","canonical_owner"],"type":"object"},"edge":{"additionalProperties":false,"properties":{"contract":{"minLength":3,"type":"string"},"edge_id":{"pattern":"^EDGE-[0-9]{2}$","type":"string"},"from_component":{"type":"string"},"interaction":{"minLength":3,"type":"string"},"to_component":{"type":"string"}},"required":["edge_id","from_component","to_component","contract","interaction"],"type":"object"},"scenario":{"additionalProperties":false,"properties":{"expected_terminal_state":{"enum":["completed","cancelled","blocked"]},"name":{"type":"string"},"required_assertions":{"items":{"type":"string"},"minItems":3,"type":"array","uniqueItems":true},"scenario_id":{"pattern":"^E2E-NS-[0-9]{3}$","type":"string"}},"required":["scenario_id","name","expected_terminal_state","required_assertions"],"type":"object"},"stage":{"additionalProperties":false,"properties":{"canonical_write_mode":{"const":"commands_only"},"checkpoint_id":{"pattern":"^CHECKPOINT-[0-9]{2}$","type":"string"},"command_sequence":{"items":{"type":"string"},"minItems":2,"type":"array"},"exit_gate":{"pattern":"^GATE-[0-9]{2}$","type":"string"},"founder_gate_required":{"type":"boolean"},"lifecycle_stage_id":{"pattern":"^LIFE-STAGE-[0-9]{2}$","type":"string"},"name":{"type":"string"},"primary_agents":{"items":{"type":"string"},"minItems":1,"type":"array","uniqueItems":true},"required_outputs":{"items":{"type":"string"},"minItems":3,"type":"array","uniqueItems":true},"restart_safe":{"const":true},"sequence":{"maximum":13,"minimum":1,"type":"integer"},"stage_id":{"pattern":"^NS-STAGE-[0-9]{2}$","type":"string"}},"required":["stage_id","sequence","lifecycle_stage_id","name","primary_agents","command_sequence","founder_gate_required","required_outputs","checkpoint_id","restart_safe","exit_gate","canonical_write_mode"],"type":"object"},"wave":{"additionalProperties":false,"properties":{"completion_gate":{"minLength":5,"type":"string"},"depends_on":{"items":{"type":"string"},"maxItems":1,"type":"array","uniqueItems":true},"name":{"type":"string"},"wave_id":{"pattern":"^NS-WAVE-[0-9]{2}$","type":"string"}},"required":["wave_id","name","depends_on","completion_gate"],"type":"object"}},"$id":"https://offdata.local/schemas/northstar-integration-blueprint.schema.json","$schema":"https://json-schema.org/draft/2020-12/schema","additionalProperties":false,"properties":{"acceptance_obligations":{"items":{"type":"string"},"minItems":16,"type":"array","uniqueItems":true},"activation":{"additionalProperties":false,"properties":{"autonomous_merge_authorized":{"const":false},"blueprint_complete":{"const":true},"codex_start_authorized":{"const":false},"external_actions_authorized":{"const":false},"hermes_activation_authorized":{"const":false},"implementation_authorized":{"const":false},"paid_services_authorized":{"const":false},"production_deployment_authorized":{"const":false},"real_client_data_enabled":{"const":false},"runtime_activation_authorized":{"const":false}},"required":["blueprint_complete","implementation_authorized","runtime_activation_authorized","hermes_activation_authorized","codex_start_authorized","real_client_data_enabled","external_actions_authorized","production_deployment_authorized","paid_services_authorized","autonomous_merge_authorized"],"type":"object"},"architecture_principles":{"items":{"type":"string"},"minItems":10,"type":"array","uniqueItems":true},"boundaries":{"additionalProperties":false,"properties":{"autonomous_merge_enabled":{"const":false},"canonical_write_mode":{"const":"commands_only"},"external_send_enabled":{"const":false},"founder_accountability_preserved":{"const":true},"paid_services_enabled":{"const":false},"phase_progression_authorized":{"const":false},"production_deployment_enabled":{"const":false},"real_client_data_enabled":{"const":false},"release_mode":{"const":"internal_synthetic_only"},"runtime_memory_is_canonical":{"const":false}},"required":["founder_accountability_preserved","canonical_write_mode","runtime_memory_is_canonical","release_mode","external_send_enabled","real_client_data_enabled","production_deployment_enabled","paid_services_enabled","autonomous_merge_enabled","phase_progression_authorized"],"type":"object"},"canonical_branch":{"const":"main"},"canonical_ownership":{"additionalProperties":{"type":"string"},"minProperties":7,"type":"object"},"contract_id":{"minLength":10,"type":"string"},"e2e_scenarios":{"items":{"$ref":"#/$defs/scenario"},"maxItems":7,"minItems":7,"type":"array"},"generated_from":{"const":"configs/northstar-integration-blueprint.yaml"},"implementation_waves":{"items":{"$ref":"#/$defs/wave"},"maxItems":8,"minItems":8,"type":"array"},"integration_components":{"items":{"$ref":"#/$defs/component"},"maxItems":13,"minItems":13,"type":"array"},"integration_edges":{"items":{"$ref":"#/$defs/edge"},"maxItems":20,"minItems":20,"type":"array"},"journey_stages":{"items":{"$ref":"#/$defs/stage"},"maxItems":13,"minItems":13,"type":"array"},"northstar_fixture":{"additionalProperties":false,"properties":{"client_name":{"const":"Northstar"},"data_mode":{"const":"synthetic_only"},"decision_owner":{"minLength":3,"type":"string"},"engagement_archetype":{"const":"ai_audit"},"engagement_type":{"const":"digital_and_ai_transformation"},"fixture_id":{"const":"FIXTURE-DAI-001"},"objective":{"minLength":80,"type":"string"},"oracle_version":{"const":"1.0.0"},"region":{"const":"Singapore"},"semantic_model_id":{"const":"DSM-DAI-001"},"story_model_id":{"const":"STORY-DAI-001"}},"required":["fixture_id","client_name","engagement_type","engagement_archetype","data_mode","region","decision_owner","semantic_model_id","story_model_id","oracle_version","objective"],"type":"object"},"phase_id":{"const":"PCR-07"},"prior_phase_dependencies":{"const":["PCR-01","PCR-02","PCR-03","PCR-04","PCR-05","PCR-06"]},"readiness_snapshot":{"additionalProperties":false,"properties":{"agent_count":{"minimum":0,"type":"integer"},"command_count":{"minimum":0,"type":"integer"},"event_count":{"minimum":0,"type":"integer"},"implementation_wave_count":{"minimum":0,"type":"integer"},"integration_component_count":{"minimum":0,"type":"integer"},"integration_edge_count":{"minimum":0,"type":"integer"},"lifecycle_stage_count":{"minimum":0,"type":"integer"},"local_prerequisites_passed":{"type":"boolean"},"model_count":{"minimum":0,"type":"integer"},"northstar_implementation_authorized":{"type":"boolean"},"oracle_grade_passed":{"type":"boolean"},"pcr04_codex_start_authorized":{"type":"boolean"},"pcr05_runtime_activation_authorized":{"type":"boolean"},"pcr06_hermes_activation_authorized":{"type":"boolean"},"primary_fixture_count":{"minimum":0,"type":"integer"},"scenario_count":{"minimum":0,"type":"integer"},"semantic_grade_passed":{"type":"boolean"}},"required":["lifecycle_stage_count","command_count","event_count","model_count","agent_count","primary_fixture_count","integration_component_count","integration_edge_count","scenario_count","implementation_wave_count","oracle_grade_passed","semantic_grade_passed","pcr04_codex_start_authorized","pcr05_runtime_activation_authorized","pcr06_hermes_activation_authorized","local_prerequisites_passed","northstar_implementation_authorized"],"type":"object"},"repository":{"const":"rayrayxing/offdata-os"},"schema_version":{"const":1},"status":{"const":"integration_blueprint_only"}},"required":["schema_version","phase_id","contract_id","repository","canonical_branch","status","northstar_fixture","architecture_principles","activation","canonical_ownership","acceptance_obligations","prior_phase_dependencies","boundaries","integration_components","integration_edges","journey_stages","e2e_scenarios","implementation_waves","generated_from","readiness_snapshot"],"title":"PCR-07 Northstar end-to-end integration blueprint","type":"object"}
