{"acceptance_obligations":["one_command_local_start","synthetic_fixture_load_is_deterministic","all_13_lifecycle_stages_and_gates_are_recorded","restart_resumes_from_last_durable_checkpoint","idempotent_commands_do_not_duplicate_effects","every_material_claim_traces_to_evidence_or_named_analysis","all_material_numbers_resolve_to_deterministic_outputs","independent_quality_context_is_separate_from_creator_context","blocking_defects_prevent_release","founder_approval_is_scoped_to_exact_version_and_action","six_deliverable_surfaces_reconcile_to_one_story_model","no_real_client_data_or_external_send","tenant_isolation_passes","audit_correlation_spans_command_event_agent_tool_and_artefact","benefits_use_baseline_counterfactual_owner_and_verification","rollback_preserves_prior_governance_and_evidence"],"activation":{"autonomous_merge_authorized":false,"blueprint_complete":true,"codex_start_authorized":false,"external_actions_authorized":false,"hermes_activation_authorized":false,"implementation_authorized":false,"paid_services_authorized":false,"production_deployment_authorized":false,"real_client_data_enabled":false,"runtime_activation_authorized":false},"architecture_principles":["database_is_system_of_record","commands_only_canonical_writes","runtime_memory_noncanonical","evidence_before_assertion","deterministic_calculation","one_story_many_surfaces","independent_quality_before_release","founder_accountability_for_material_decisions","provider_and_runtime_replaceability","synthetic_local_first"],"boundaries":{"autonomous_merge_enabled":false,"canonical_write_mode":"commands_only","external_send_enabled":false,"founder_accountability_preserved":true,"paid_services_enabled":false,"phase_progression_authorized":false,"production_deployment_enabled":false,"real_client_data_enabled":false,"release_mode":"internal_synthetic_only","runtime_memory_is_canonical":false},"canonical_branch":"main","canonical_ownership":{"agent_memory":"noncanonical_ephemeral","file_state":"object_storage_immutable_versions","hermes_memory":"noncanonical_disabled_for_client_truth","release_authority":"founder_scoped_approval","story_state":"versioned_semantic_model","structured_state":"postgresql_via_validated_commands","workflow_state":"durable_runtime_checkpoint_only"},"contract_id":"OFFDATA-NORTHSTAR-E2E-BLUEPRINT-2026-08-05","e2e_scenarios":[{"expected_terminal_state":"completed","name":"synthetic_happy_path","required_assertions":["all_13_lifecycle_gates_recorded","independent_quality_precedes_release","benefit_verification_defined"],"scenario_id":"E2E-NS-001"},{"expected_terminal_state":"completed","name":"restart_after_analysis_checkpoint","required_assertions":["resume_from_checkpoint_08","no_duplicate_agent_output","no_duplicate_release_action"],"scenario_id":"E2E-NS-002"},{"expected_terminal_state":"completed","name":"approval_wait_and_resume","required_assertions":["workflow_blocks_until_scoped_approval","approval_version_recorded","workflow_resumed_event_recorded"],"scenario_id":"E2E-NS-003"},{"expected_terminal_state":"completed","name":"blocking_quality_defect_recycle","required_assertions":["release_prohibited","recycle_to_affected_gate","repair_and_retest_recorded"],"scenario_id":"E2E-NS-004"},{"expected_terminal_state":"completed","name":"idempotent_release_replay","required_assertions":["single_artefact_released_event","immutable_baseline_unchanged","duplicate_effect_prevented"],"scenario_id":"E2E-NS-005"},{"expected_terminal_state":"cancelled","name":"founder_cancellation","required_assertions":["engagement_cancelled_event_recorded","further_execution_prohibited","completed_effects_not_repeated"],"scenario_id":"E2E-NS-006"},{"expected_terminal_state":"blocked","name":"tenant_and_data_boundary_rejection","required_assertions":["request_denied","no_cross_tenant_context","no_real_client_data_persisted"],"scenario_id":"E2E-NS-007"}],"generated_from":"configs/northstar-integration-blueprint.yaml","implementation_waves":[{"completion_gate":"phase_0_founder_demo","depends_on":[],"name":"foundation_and_contract_shells","wave_id":"NS-WAVE-01"},{"completion_gate":"records_survive_restart","depends_on":["NS-WAVE-01"],"name":"canonical_state_and_fixture_loading","wave_id":"NS-WAVE-02"},{"completion_gate":"interruption_and_replay_scenarios_pass","depends_on":["NS-WAVE-02"],"name":"durable_lifecycle_and_policy","wave_id":"NS-WAVE-03"},{"completion_gate":"agent_contract_and_permission_tests_pass","depends_on":["NS-WAVE-03"],"name":"bounded_agent_and_context_integration","wave_id":"NS-WAVE-04"},{"completion_gate":"oracle_grade_and_traceability_pass","depends_on":["NS-WAVE-04"],"name":"evidence_and_analytical_oracle_execution","wave_id":"NS-WAVE-05"},{"completion_gate":"office_and_visual_validation_pass","depends_on":["NS-WAVE-05"],"name":"semantic_story_and_renderer_integration","wave_id":"NS-WAVE-06"},{"completion_gate":"no_blocking_defects_and_scoped_approval","depends_on":["NS-WAVE-06"],"name":"independent_quality_and_release","wave_id":"NS-WAVE-07"},{"completion_gate":"benefit_verification_and_closure_pass","depends_on":["NS-WAVE-07"],"name":"implementation_benefits_and_closeout","wave_id":"NS-WAVE-08"}],"integration_components":[{"canonical_owner":false,"component_id":"COMP-UI","layer":"interface","name":"Founder cockpit and engagement workspace"},{"canonical_owner":false,"component_id":"COMP-API","layer":"control_plane","name":"Offdata API and policy engine"},{"canonical_owner":true,"component_id":"COMP-STATE","layer":"canonical_state","name":"PostgreSQL engagement system of record"},{"canonical_owner":true,"component_id":"COMP-OBJECT","layer":"canonical_files","name":"Object storage and immutable artefact baselines"},{"canonical_owner":false,"component_id":"COMP-WORKFLOW","layer":"orchestration","name":"Durable workflow adapter"},{"canonical_owner":false,"component_id":"COMP-AGENT","layer":"reasoning","name":"Typed agent runtime adapter"},{"canonical_owner":false,"component_id":"COMP-WORKER","layer":"execution","name":"Bounded worker harness"},{"canonical_owner":false,"component_id":"COMP-TOOLS","layer":"tools","name":"Declared tool runtime"},{"canonical_owner":false,"component_id":"COMP-KNOWLEDGE","layer":"evidence","name":"Knowledge, source and evidence services"},{"canonical_owner":false,"component_id":"COMP-ANALYTICS","layer":"analysis","name":"Governed deterministic analytics"},{"canonical_owner":false,"component_id":"COMP-DELIVERY","layer":"deliverables","name":"Semantic story and multi-format renderer boundary"},{"canonical_owner":false,"component_id":"COMP-QA","layer":"assurance","name":"Independent quality and release control"},{"canonical_owner":false,"component_id":"COMP-BENEFITS","layer":"outcomes","name":"Implementation and benefits tracking"}],"integration_edges":[{"contract":"CommandEnvelope","edge_id":"EDGE-01","from_component":"COMP-UI","interaction":"request_response","to_component":"COMP-API"},{"contract":"CommandResponse and DomainEvent","edge_id":"EDGE-02","from_component":"COMP-API","interaction":"validated_canonical_write","to_component":"COMP-STATE"},{"contract":"TransitionRequest","edge_id":"EDGE-03","from_component":"COMP-STATE","interaction":"read_and_checkpoint","to_component":"COMP-WORKFLOW"},{"contract":"AgentRuntimeRequest","edge_id":"EDGE-04","from_component":"COMP-WORKFLOW","interaction":"bounded_invocation","to_component":"COMP-AGENT"},{"contract":"record_agent_output","edge_id":"EDGE-05","from_component":"COMP-AGENT","interaction":"propose_only","to_component":"COMP-API"},{"contract":"WorkerPackage","edge_id":"EDGE-06","from_component":"COMP-WORKFLOW","interaction":"bounded_invocation","to_component":"COMP-WORKER"},{"contract":"ToolInvocation","edge_id":"EDGE-07","from_component":"COMP-WORKER","interaction":"allowlisted_invocation","to_component":"COMP-TOOLS"},{"contract":"ToolResult","edge_id":"EDGE-08","from_component":"COMP-TOOLS","interaction":"record_via_command","to_component":"COMP-API"},{"contract":"ContextPackage","edge_id":"EDGE-09","from_component":"COMP-KNOWLEDGE","interaction":"minimum_sufficient_context","to_component":"COMP-AGENT"},{"contract":"SourceDocument","edge_id":"EDGE-10","from_component":"COMP-OBJECT","interaction":"immutable_source_reference","to_component":"COMP-KNOWLEDGE"},{"contract":"record_agent_output","edge_id":"EDGE-11","from_component":"COMP-ANALYTICS","interaction":"named_output_recording","to_component":"COMP-API"},{"contract":"StoryModel inputs","edge_id":"EDGE-12","from_component":"COMP-STATE","interaction":"versioned_read","to_component":"COMP-DELIVERY"},{"contract":"DeliverableManifest","edge_id":"EDGE-13","from_component":"COMP-DELIVERY","interaction":"immutable_baseline_write","to_component":"COMP-OBJECT"},{"contract":"CrossFormatReconciliation","edge_id":"EDGE-14","from_component":"COMP-DELIVERY","interaction":"independent_review_input","to_component":"COMP-QA"},{"contract":"request_approval","edge_id":"EDGE-15","from_component":"COMP-QA","interaction":"founder_gate","to_component":"COMP-API"},{"contract":"record_approval","edge_id":"EDGE-16","from_component":"COMP-UI","interaction":"scoped_founder_decision","to_component":"COMP-API"},{"contract":"release_artefact","edge_id":"EDGE-17","from_component":"COMP-API","interaction":"idempotent_internal_synthetic_release","to_component":"COMP-OBJECT"},{"contract":"approved recommendation and benefit baseline","edge_id":"EDGE-18","from_component":"COMP-STATE","interaction":"versioned_read","to_component":"COMP-BENEFITS"},{"contract":"record_agent_output","edge_id":"EDGE-19","from_component":"COMP-BENEFITS","interaction":"verified_outcome_recording","to_component":"COMP-API"},{"contract":"DomainEvent checkpoint","edge_id":"EDGE-20","from_component":"COMP-WORKFLOW","interaction":"durable_resume","to_component":"COMP-STATE"}],"journey_stages":[{"canonical_write_mode":"commands_only","checkpoint_id":"CHECKPOINT-01","command_sequence":["create_engagement","update_mandate","propose_transition"],"exit_gate":"GATE-01","